{
  "schema_version": "1.0.0",
  "taxonomy": "system-components",
  "title": "Enact System Components",
  "description": "Component catalog for Enact deployments - logical building blocks with swappable implementations",
  "components": [
    {
      "slug": "reverse-proxy",
      "name": "Reverse Proxy",
      "description": "TLS termination, routing, and load balancing for all services",
      "category": "infrastructure",
      "required": true,
      "default_implementation": "caddy",
      "provides_capability": [
        "tls-termination",
        "reverse-proxy",
        "load-balancing",
        "static-hosting"
      ],
      "ports": [
        {
          "port": 80,
          "protocol": "tcp",
          "purpose": "HTTP (redirect to HTTPS)",
          "public": true
        },
        {
          "port": 443,
          "protocol": "tcp",
          "purpose": "HTTPS",
          "public": true
        }
      ],
      "implementations": [
        {
          "slug": "caddy",
          "name": "Caddy",
          "description": "Modern web server with automatic HTTPS. Recommended for most deployments.",
          "homepage": "https://caddyserver.com",
          "docs_url": "https://caddyserver.com/docs/",
          "license": "Apache-2.0",
          "maturity": "stable",
          "default_version": "2.8.4",
          "supported_versions": [
            "2.7.x",
            "2.8.x"
          ],
          "variant_behavior": {
            "minimal": {
              "mode": "single",
              "template": "Caddyfile.minimal.tmpl",
              "notes": "Single instance, self-signed certs acceptable"
            },
            "standard": {
              "mode": "single",
              "template": "Caddyfile.standard.tmpl",
              "notes": "Single instance with Let's Encrypt"
            },
            "ha": {
              "mode": "clustered",
              "template": "Caddyfile.ha.tmpl",
              "requires": {
                "shared_storage": true,
                "load_balancer": true
              },
              "additional_plugins": [
                "caddy-storage-s3"
              ],
              "notes": "Clustered with shared certificate storage"
            }
          },
          "tags": [
            "recommended",
            "auto-https",
            "simple-config"
          ]
        },
        {
          "slug": "nginx",
          "name": "nginx",
          "description": "High-performance web server. Use when Caddy doesn't meet requirements.",
          "homepage": "https://nginx.org",
          "docs_url": "https://nginx.org/en/docs/",
          "license": "BSD-2-Clause",
          "maturity": "stable",
          "default_version": "1.27",
          "supported_versions": [
            "1.24.x",
            "1.26.x",
            "1.27.x"
          ],
          "variant_behavior": {
            "minimal": {
              "mode": "single",
              "template": "nginx.minimal.conf.tmpl"
            },
            "standard": {
              "mode": "single",
              "template": "nginx.standard.conf.tmpl"
            },
            "ha": {
              "mode": "clustered",
              "template": "nginx.ha.conf.tmpl",
              "requires": {
                "load_balancer": true,
                "shared_storage": true
              }
            }
          },
          "tags": [
            "high-performance",
            "complex-config"
          ]
        },
        {
          "slug": "traefik",
          "name": "Traefik",
          "description": "Cloud-native reverse proxy with dynamic configuration. Good for Kubernetes.",
          "homepage": "https://traefik.io",
          "docs_url": "https://doc.traefik.io/traefik/",
          "license": "MIT",
          "maturity": "stable",
          "default_version": "3.2",
          "supported_versions": [
            "2.11.x",
            "3.x"
          ],
          "variant_behavior": {
            "standard": {
              "mode": "single",
              "template": "traefik.standard.yaml.tmpl"
            },
            "ha": {
              "mode": "clustered",
              "template": "traefik.ha.yaml.tmpl",
              "requires": {
                "load_balancer": true
              }
            }
          },
          "tags": [
            "cloud-native",
            "docker-native",
            "kubernetes"
          ]
        }
      ]
    },
    {
      "slug": "identity",
      "name": "Identity Provider",
      "description": "Authentication, authorization, and user management (SSO/OIDC)",
      "category": "platform",
      "required": true,
      "default_implementation": "authentik",
      "provides_capability": [
        "authentication",
        "sso",
        "oidc-provider",
        "user-management"
      ],
      "ports": [
        {
          "port": 9000,
          "protocol": "tcp",
          "purpose": "Web UI and API",
          "public": false
        },
        {
          "port": 9443,
          "protocol": "tcp",
          "purpose": "HTTPS (when not behind proxy)",
          "public": false
        }
      ],
      "implementations": [
        {
          "slug": "authentik",
          "name": "Authentik",
          "description": "Modern identity provider with excellent UX. Recommended for most deployments.",
          "homepage": "https://goauthentik.io",
          "docs_url": "https://docs.goauthentik.io",
          "license": "MIT",
          "maturity": "stable",
          "default_version": "2024.10.2",
          "supported_versions": [
            "2024.8.x",
            "2024.10.x"
          ],
          "variant_behavior": {
            "minimal": {
              "mode": "single",
              "template": "authentik.minimal.yaml.tmpl",
              "requires": {
                "min_memory_gb": 2
              }
            },
            "standard": {
              "mode": "single",
              "template": "authentik.standard.yaml.tmpl",
              "requires": {
                "min_memory_gb": 4
              }
            },
            "ha": {
              "mode": "clustered",
              "template": "authentik.ha.yaml.tmpl",
              "requires": {
                "min_nodes": 2,
                "managed_database": true,
                "min_memory_gb": 4
              }
            }
          },
          "dependencies": [
            "database",
            "cache"
          ],
          "tags": [
            "recommended",
            "modern-ui",
            "oidc",
            "saml"
          ]
        },
        {
          "slug": "keycloak",
          "name": "Keycloak",
          "description": "Enterprise-grade identity management. More complex but very capable.",
          "homepage": "https://www.keycloak.org",
          "docs_url": "https://www.keycloak.org/documentation",
          "license": "Apache-2.0",
          "maturity": "stable",
          "default_version": "26.0",
          "supported_versions": [
            "24.x",
            "25.x",
            "26.x"
          ],
          "variant_behavior": {
            "standard": {
              "mode": "single",
              "template": "keycloak.standard.yaml.tmpl",
              "requires": {
                "min_memory_gb": 4
              }
            },
            "ha": {
              "mode": "clustered",
              "template": "keycloak.ha.yaml.tmpl",
              "requires": {
                "min_nodes": 2,
                "managed_database": true,
                "min_memory_gb": 4
              }
            }
          },
          "dependencies": [
            "database"
          ],
          "tags": [
            "enterprise",
            "complex",
            "oidc",
            "saml",
            "ldap"
          ]
        }
      ]
    },
    {
      "slug": "lms",
      "name": "Learning Management System",
      "description": "Core learning platform - course delivery, assessments, learner tracking",
      "category": "application",
      "required": false,
      "default_implementation": "tutor",
      "provides_capability": [
        "course-delivery",
        "assessment",
        "learner-tracking",
        "xapi"
      ],
      "ports": [
        {
          "port": 8000,
          "protocol": "tcp",
          "purpose": "LMS web interface",
          "public": false
        },
        {
          "port": 8001,
          "protocol": "tcp",
          "purpose": "CMS/Studio web interface",
          "public": false
        }
      ],
      "implementations": [
        {
          "slug": "tutor",
          "name": "Tutor (Open edX)",
          "description": "Docker-based Open edX deployment. The standard for Open edX.",
          "homepage": "https://docs.tutor.edly.io",
          "docs_url": "https://docs.tutor.edly.io",
          "license": "AGPL-3.0-only",
          "maturity": "stable",
          "default_version": "18.1.3",
          "supported_versions": [
            "17.x",
            "18.x"
          ],
          "variant_behavior": {
            "minimal": {
              "mode": "single",
              "template": "tutor.minimal.yaml.tmpl",
              "requires": {
                "min_vcpus": 2,
                "min_memory_gb": 8,
                "min_storage_gb": 50
              },
              "notes": "Development/testing only"
            },
            "standard": {
              "mode": "single",
              "template": "tutor.standard.yaml.tmpl",
              "requires": {
                "min_vcpus": 4,
                "min_memory_gb": 16,
                "min_storage_gb": 100
              }
            },
            "ha": {
              "mode": "clustered",
              "template": "tutor.ha.yaml.tmpl",
              "requires": {
                "min_nodes": 2,
                "min_vcpus": 4,
                "min_memory_gb": 16,
                "managed_database": true,